[
  {
    "card_id": "EDOS_CARD_001",
    "status": "candidate",
    "source": {
      "source_id": "EU_PARL_2021_RESOLUTION_CYBERVIOLENCE",
      "title": "Combating gender-based violence: cyberviolence",
      "publisher": "European Parliament",
      "year": 2021,
      "page": null,
      "section": "Typology of cyberviolence",
      "url": "https://www.europarl.europa.eu/doceo/document/TA-9-2021-0489_EN.html"
    },
    "source_quote": "rape threats",
    "claim": "Rape threats can be treated as a form of gender-based cyberviolence, not as ordinary hostile disagreement.",
    "primary_edos_label": "1.1 threats of harm",
    "secondary_edos_labels": [
      "1.2 incitement and encouragement of harm"
    ],
    "edos_alignment": "Useful for threats framed as jokes, fantasies, or intimidation because it anchors them as violence-related speech.",
    "retrieval_keywords": [
      "rape threats",
      "threat",
      "intimidation",
      "cyberviolence",
      "women"
    ],
    "validation": {
      "status": "not_validated",
      "faithfulness": null,
      "edos_alignment": null,
      "usefulness": null,
      "notes": null
    }
  },
  {
    "card_id": "EDOS_CARD_002",
    "status": "candidate",
    "source": {
      "source_id": "EU_PARL_2021_RESOLUTION_CYBERVIOLENCE",
      "title": "Combating gender-based violence: cyberviolence",
      "publisher": "European Parliament",
      "year": 2021,
      "page": null,
      "section": "Typology of cyberviolence",
      "url": "https://www.europarl.europa.eu/doceo/document/TA-9-2021-0489_EN.html"
    },
    "source_quote": "direct threats",
    "claim": "Direct threats against women are explicitly part of the cyberviolence landscape identified by the European Parliament.",
    "primary_edos_label": "1.1 threats of harm",
    "secondary_edos_labels": [
      "2.2 aggressive and emotive attacks"
    ],
    "edos_alignment": "Useful when the hate speech contains explicit intimidation, punishment, or promises of harm.",
    "retrieval_keywords": [
      "direct threats",
      "harm",
      "violence",
      "intimidation",
      "safety"
    ],
    "validation": {
      "status": "not_validated",
      "faithfulness": null,
      "edos_alignment": null,
      "usefulness": null,
      "notes": null
    }
  },
  {
    "card_id": "EDOS_CARD_003",
    "status": "candidate",
    "source": {
      "source_id": "EU_PARL_2021_RESOLUTION_CYBERVIOLENCE",
      "title": "Combating gender-based violence: cyberviolence",
      "publisher": "European Parliament",
      "year": 2021,
      "page": null,
      "section": "Typology of cyberviolence",
      "url": "https://www.europarl.europa.eu/doceo/document/TA-9-2021-0489_EN.html"
    },
    "source_quote": "cyberstalking",
    "claim": "Cyberstalking is a threat-related form of online abuse because it can create fear, control, and ongoing intimidation.",
    "primary_edos_label": "1.1 threats of harm",
    "secondary_edos_labels": [],
    "edos_alignment": "Useful for hate speech that implies surveillance, pursuit, tracking, or repeated threatening attention.",
    "retrieval_keywords": [
      "cyberstalking",
      "surveillance",
      "fear",
      "control",
      "threat"
    ],
    "validation": {
      "status": "not_validated",
      "faithfulness": null,
      "edos_alignment": null,
      "usefulness": null,
      "notes": null
    }
  },
  {
    "card_id": "EDOS_CARD_004",
    "status": "candidate",
    "source": {
      "source_id": "GREVIO_2021_DIGITAL_DIMENSION",
      "title": "GREVIO General Recommendation No. 1 on the digital dimension of violence against women",
      "publisher": "Council of Europe / GREVIO",
      "year": 2021,
      "page": null,
      "section": "Digital dimension of violence",
      "url": "https://edoc.coe.int/en/violence-against-women/10643-grevio-general-recommendation-no-1-on-the-digital-dimension-of-violence-against-women.html"
    },
    "source_quote": "online or with the help of technology",
    "claim": "Technology can be used to extend violence against women beyond physical spaces and into digital environments.",
    "primary_edos_label": "1.1 threats of harm",
    "secondary_edos_labels": [
      "4.1 supporting mistreatment of individual women"
    ],
    "edos_alignment": "Useful when the threat is dismissed because it happens online rather than face-to-face.",
    "retrieval_keywords": [
      "online violence",
      "technology",
      "threat",
      "digital dimension",
      "women"
    ],
    "validation": {
      "status": "not_validated",
      "faithfulness": null,
      "edos_alignment": null,
      "usefulness": null,
      "notes": null
    }
  },
  {
    "card_id": "EDOS_CARD_005",
    "status": "candidate",
    "source": {
      "source_id": "EU_DIRECTIVE_2024_1385",
      "title": "Directive (EU) 2024/1385 on combating violence against women and domestic violence",
      "publisher": "European Union / EUR-Lex",
      "year": 2024,
      "page": null,
      "section": "Cyber offences",
      "url": "https://eur-lex.europa.eu/eli/dir/2024/1385/oj/eng"
    },
    "source_quote": "cyber stalking",
    "claim": "Cyber stalking is recognized in the EU legal framework on violence against women and domestic violence.",
    "primary_edos_label": "1.1 threats of harm",
    "secondary_edos_labels": [
      "4.2 supporting systemic discrimination against women as a group"
    ],
    "edos_alignment": "Useful for institutional or safety-oriented rebuttals to stalking-like threats.",
    "retrieval_keywords": [
      "cyber stalking",
      "law",
      "EU",
      "violence against women",
      "safety"
    ],
    "validation": {
      "status": "not_validated",
      "faithfulness": null,
      "edos_alignment": null,
      "usefulness": null,
      "notes": null
    }
  },
  {
    "card_id": "EDOS_CARD_006",
    "status": "candidate",
    "source": {
      "source_id": "EU_PARL_2021_RESOLUTION_CYBERVIOLENCE",
      "title": "Combating gender-based violence: cyberviolence",
      "publisher": "European Parliament",
      "year": 2021,
      "page": null,
      "section": "Typology of cyberviolence",
      "url": "https://www.europarl.europa.eu/doceo/document/TA-9-2021-0489_EN.html"
    },
    "source_quote": "calls to violence",
    "claim": "Calls to violence against women belong to the same cyberviolence typology as direct threats.",
    "primary_edos_label": "1.2 incitement and encouragement of harm",
    "secondary_edos_labels": [
      "1.1 threats of harm"
    ],
    "edos_alignment": "Useful for content that encourages others to harm women, even when the speaker does not personally threaten to act.",
    "retrieval_keywords": [
      "calls to violence",
      "incitement",
      "harm",
      "women",
      "hate"
    ],
    "validation": {
      "status": "not_validated",
      "faithfulness": null,
      "edos_alignment": null,
      "usefulness": null,
      "notes": null
    }
  },
  {
    "card_id": "EDOS_CARD_007",
    "status": "candidate",
    "source": {
      "source_id": "EU_PARL_2021_RESOLUTION_CYBERVIOLENCE",
      "title": "Combating gender-based violence: cyberviolence",
      "publisher": "European Parliament",
      "year": 2021,
      "page": null,
      "section": "Typology of cyberviolence",
      "url": "https://www.europarl.europa.eu/doceo/document/TA-9-2021-0489_EN.html"
    },
    "source_quote": "sexist hate speech",
    "claim": "Sexist hate speech can include content that incites hatred or violence against women and gender-diverse people.",
    "primary_edos_label": "1.2 incitement and encouragement of harm",
    "secondary_edos_labels": [
      "3.1 casual use of gendered slurs, profanities, and insults"
    ],
    "edos_alignment": "Useful for distinguishing incitement from generic offensiveness: the issue is encouragement of hatred or violence.",
    "retrieval_keywords": [
      "sexist hate speech",
      "incitement",
      "hatred",
      "violence",
      "women"
    ],
    "validation": {
      "status": "not_validated",
      "faithfulness": null,
      "edos_alignment": null,
      "usefulness": null,
      "notes": null
    }
  },
  {
    "card_id": "EDOS_CARD_008",
    "status": "candidate",
    "source": {
      "source_id": "EU_PARL_2021_RESOLUTION_CYBERVIOLENCE",
      "title": "Combating gender-based violence: cyberviolence",
      "publisher": "European Parliament",
      "year": 2021,
      "page": null,
      "section": "Typology of cyberviolence",
      "url": "https://www.europarl.europa.eu/doceo/document/TA-9-2021-0489_EN.html"
    },
    "source_quote": "inducements to inflict violence",
    "claim": "Online content can encourage self-directed violence and psychological injury, which is relevant to harm-inciting hate.",
    "primary_edos_label": "1.2 incitement and encouragement of harm",
    "secondary_edos_labels": [
      "4.1 supporting mistreatment of individual women"
    ],
    "edos_alignment": "Useful for misogynistic content that pushes women toward self-harm or celebrates self-directed harm.",
    "retrieval_keywords": [
      "self harm",
      "psychic injury",
      "incitement",
      "violence",
      "harm"
    ],
    "validation": {
      "status": "not_validated",
      "faithfulness": null,
      "edos_alignment": null,
      "usefulness": null,
      "notes": null
    }
  },
  {
    "card_id": "EDOS_CARD_009",
    "status": "candidate",
    "source": {
      "source_id": "EU_DIRECTIVE_2024_1385",
      "title": "Directive (EU) 2024/1385 on combating violence against women and domestic violence",
      "publisher": "European Union / EUR-Lex",
      "year": 2024,
      "page": null,
      "section": "Cyber offences",
      "url": "https://eur-lex.europa.eu/eli/dir/2024/1385/oj/eng"
    },
    "source_quote": "cyber incitement",
    "claim": "The EU framework treats cyber incitement as a legally relevant form of violence-related online conduct.",